Platform Name,Company,Primary Audience,Regions (Focus),Supported Sports,AI/Adaptive Training,Cross-Training Recognition,Dynamic Scheduling,Strava Integration,Wearable/Data Sync,Coach/Human Support,Plan Type,Strength/Yoga Content,Pricing,Market Positioning,Key Differentiators,Key Weaknesses,Notes
Nike Run Club (NRC),Nike,Runners (beginners to intermediate),Global (US/EU strong),Running (indoor/outdoor),No – static plans & guided runs,Minimal – can log but not integrated into plans,No – missed sessions do not auto-adjust,No direct (manual/3rd-party export),Apple Watch app; phone GPS,No (audio guidance only),Pre-built plans + guided runs,Via separate Nike Training Club app,Free,B2C,High-quality free guided runs; global community challenges,No personalization/adaptivity; running-only focus,
Runna,Runna (Strava),Serious runners; race-focused,Global (UK/US/EU),Running (+ tracks cross-training days),Yes – adjusts based on performance & adherence,"Partial – imports/acknowledges, plan remains run-centric",Yes – reschedules & adapts missed/shifted sessions,Yes,"Garmin, Apple Watch, COROS, etc.",Limited (support staff; no 1:1 coach),Adaptive personalized plans,Yes – curated S&C; some yoga/pilates classes,≈ €20/mo or €120/yr,B2C (premium),Flexible scheduling; device integrations; holistic tips,Paywalled; no live coaching; run-first bias,
Adidas Running (Runtastic),Adidas,Recreational runners & fitness users,Global (EU/US),"Running, walking, cycling; links to Adidas Training for strength",Limited – adaptive plan difficulty via feedback,"Yes (manual) – tracked, not deeply integrated into run plans",Limited – manual edits; plan difficulty updates,No direct (export/workarounds),"Garmin, Apple Health/Google Fit",No,Pre-built + slight adaptivity,Yes via Adidas Training app,Freemium; Premium ≈ $9.99/mo or $49.99/yr,B2C,Brand ecosystem; community challenges,Two-app experience; limited true personalization,
ASICS Runkeeper,ASICS Digital,Runners (all levels; beginner-friendly),Global (US/EU),"Running; logs cycling, walking, swimming",No – custom schedules that don’t auto-adapt,Basic logging only,No – user must edit plan manually,No native (3rd-party tools),Apple Watch app; phone GPS,No,Pre-built plans (some free; more in premium),No (manual logging only),Freemium; Go ≈ €9–11/mo or €40/yr,B2C,Simple UX; configurable audio cues,Limited analytics & adaptivity,
Strava,"Strava, Inc.",Endurance & fitness community (all sports),Global,"30+ sports (run, ride, swim, hike, gym, etc.)",Limited – AI ‘Athlete Intelligence’ insights; no plans,Yes – all activities tracked & contribute to fitness,No – no planner; tracking & social only,N/A (hub),"Garmin, Polar, Suunto, COROS, Apple Watch, etc.",No (clubs/community only),N/A (no plans),No (activity logging only),Freemium; Sub ≈ €11.99/mo or €79.99/yr,B2C – social/tracking,Largest fitness community; segments & leaderboards,No structured training plans/coaching,
MOTTIV,MOTTIV,Amateur endurance athletes (multi-race goals),Global (US/EU),"Triathlon, running, cycling, duathlon, swim-run",Yes – fully auto-generated multi-sport plans,Yes – built-in (plans include strength/mobility),Yes – reconfigures when races/availability change,Yes,Garmin; Strava; Zwift; TP (selected),No 1:1 coach; education & community,"Adaptive, end-to-end (incl. strength & nutrition guidance)",Yes – strength & mobility sessions included,Freemium; Premium ≈ $19.99/mo or $179.99/yr,B2C,Holistic (endurance+strength+nutrition) & multi-event planning,Less flexible for heavy self-customization; newer app,
TriDot,Predictive Fitness,Triathletes seeking AI-driven coaching,Global (US/EU),Triathlon (swim/bike/run),Yes – AI-optimized plans; adjusts from data,Within S/B/R only; other sports not modeled,Yes – adjusts intensities & plan progressions,Limited (not core),"Garmin, Zwift, etc.",Optional premium human coaching tiers,Fully adaptive tri plans,Limited (not core),$39/mo (AI) to $399/mo (with coach),B2C (premium tiers),"High-end AI, IRONMAN partner",Expensive; tri-specific; minimal non-S/B/R integration,
Freeletics,Freeletics GmbH,General fitness & HIIT users; runners optional,Global (EU strong),Bodyweight HIIT + Running,Yes – weekly adaptive AI Coach,Partial – imports Strava activities; focus on Freeletics sessions,Yes – weekly plan adapts via user feedback,Yes – imports runs/rides,Apple Health/Google Fit,No (AI only),Adaptive weekly programs,Yes – bodyweight strength; some mobility,≈ €79.99/year (varies),B2C,Strong AI for bodyweight; anywhere workouts,Not endurance-specific; limited sport variety,
NCFIT,NCFIT,Functional fitness/CrossFit at-home users,US (global access),Functional fitness (mix of strength/metcon; some running/rowing),No – programmed tracks only,Within tracks only; no external activity intake,No – daily tracks; no rescheduling logic,No,No (follow-along workouts),No 1:1; on-demand class-style guidance,Pre-set tracks (4) with daily workouts,Strength; mobility in sessions (no yoga library),≈ $19.99/mo,B2C,World-class programming & video classes,No personalization; not endurance-focused,
Garmin Coach & Connect,Garmin,Runners/cyclists with Garmin devices,Global,All tracked; plans for running (+ daily suggestions for run/bike),Yes – adaptive run plans; device-driven suggestions,"Partial, it takes into account indirectly as all activities affect load & recovery",Yes – adjusts based on missed/quality sessions,Yes (auto-sync),"Garmin devices (HRV, VO2, etc.)",No (virtual coach personas only),Template plans with adaptivity + daily suggestions,Yes – on-watch strength/yoga workouts,Included with device (some premium insights paid),B2C (device ecosystem),Deep hardware integration; recovery-aware guidance,Limited plan variety; device-dependent,
,,,,,,,,,,,,,,,,,
Campus Coach ?,,,,,,,,,,,,,,,,,
Nolio ?,,,,,,,,,,,,,,,,,